Title,Description,Channel,Genre
Full Video | मईया बारी सुकवार | #Karina Pandey | #Sovita Pandey | Maiya Bari Sukwar | Navratri Song,karinapandey #sovitapandey #karinapandeykaviralgana Full Video | मईया बारी सुकवार | #Karina Pandey | #Sovita ...,PANDEY SISTERS  OFFICIAL,Bhakti
Radha Krishna Bhajan | 10 राधा कृष्ण भजन | Krishna  Bhajan 2025 | Krishna Ji Ke Bhajan  | Bhajan,Radha Krishna Bhajan | 10 राधा कृष्ण भजन | Krishan Bhajan 2025 | Radha Krishna तो आईए आज पावन ...,Bhakti Sadhna भक्ति साधना,Bhakti
Garuda Gamana Tava | Sri Maha Vishnu Stotram | Telugu Devotional Songs,GarudaGamanaTava | #mahavishnu Stotram | #TeluguDevotionalSongs | #devotional #telugu #telugu #vishnumantra Song ...,MS Music,Bhakti
Jai Maa Vaishno Devi All Song Vaishno Mata Songs Bhakti Song  Navratri special Song 2025,"Jai Maa Vaishno Devi All Songs | Vaishno Mata Songs, Devotional Songs, Navratri Special Songs, Devi Songs, New Bhakti ...",Bhanu Pratap Shastri,Bhakti
Beautiful Morning Bhajans | Krishna Bhajans | Bhakti Song | Shri Krishna Govind Hare Murari,Beautiful Morning Bhajans | Krishna Bhajans | Bhakti Song | Shri Krishna Govind Hare Murari आप सभी भक्तों से ...,Nova Spiritual India,Bhakti
AMMA BHAVANI || GODDESS DURGA DEVI POPULAR BHAKTHI SONGS ||TELUGU DEVOTIONAL SONGS ||,Aditya Bhakti is a collection of Telugu Bhakti songs that are sure to elevate your spiritual experience. Experience the power of ...,Aditya Bhakthi,Bhakti
శ్రీ లక్ష్మీదేవి భక్తి పాటలు | Sri Laxmi Devi Songs Telugu | Mahalaxmi Devotional Songs 🎶🙏,వరలక్ష్మీ వ్రతం స్పెషల్ భక్తి పాటలు | లక్ష్మీ రావే మా ఇంటికి ...,Maha Mantram - మహా మంత్రం ,Bhakti
12 विट्ठल भक्तिगीत व अभंग | विठू माऊली तू माऊली जगाची  | विठ्ठल भक्तिगीते | 13 Vitthal Songs Marathi,12 विट्ठल भक्तिगीत व अभंग | विठू माऊली तू माऊली जगाची | विठ्ठल ...,Wings Marathi Bhakti,Bhakti
तीन बाण के धारी॥छोटू सिंह रावणा||New bhajan ||Khatu Shyam|| Teen ban ke dhari ||Chotu Singh Rawna,re-editing vlog wala ladka jai shree shyam insta id ...,vlog wala ladka,Bhakti
बढ़ा ही दयालु है बांके बिहारी~bada hi dayalu hai banke bihari~chitra vichitra ji song~kanhiya song,बढ़ा ही दयालु है बांके बिहारी~bada hi dayalu hai banke bihari~chitra vichitra ji song~kanhiya song ...,Mann Ke Bhajan,Bhakti
Diwali Special ~ Jubin Nautiyal New Bhakti Songs Jukebox 2024 | Mere Ghar Ram Aaye Hai Song Jubin,Jubin Nautiyal Presents His New Bhakti Songs Jukebox 2022 #Trending_1_On_Music #JubinNautiyal #Newsongs ...,SM Creations,Bhakti
"नवरात्रि Special:SONU NIGAM Devi Bhajan,Sawan Ki Rut Hai Aaja Maa with Lyrics,सावन की रुत है आजा माँ",https://youtu.be/mEfgVVZTI9Q     Subscribe: http://www.youtube.com/tseriesbhakti Devi Bhajan: Sawan Ki Rut Hai Aaja Maa ...,T-Series Bhakti Sagar,Bhakti
#Video - बघवा आईल बा - #Tuntun Yadav | Goldi Yadav | Baghawa Aail Ba | New  Hit Devi Geet 2025,Video - बघवा आईल बा - #Tuntun Yadav | Goldi Yadav | Baghawa Aail Ba | New Hit Devi Geet 2025 Make Reels Link ...,Hero Music,Bhakti
Jubin Nautiyal Navratri 2023 Special Mata Rani Bhakti Songs Jukebox | नवरात्रि 2  दिन माँ भक्ति भजन,Jubin Nautiyal Presents His New Bhakti Songs Jukebox 2022 #Trending_1_On_Music #JubinNautiyal #Newsongs ...,SM Creations,Bhakti
"LAKHBIR SINGH LAKKHA | Devi Bhajan | Bangla Diya Gaadi Di | 🙏Aaye Maiya Ke Navrate,माता के भजन",https://youtu.be/U4RhO513gBA     Subscribe: http://www.youtube.com/tseriesbhakti Devi Bhajan: Bangla Diya Gaadi Di Singer: ...,T-Series Bhakti Sagar,Bhakti
KARTHIKA SUKRAVARAM SPECIAL | Lakshmi Devi Devotional Songs 2025 | Telugu Bhakti Geethalu,karthikamasam #telugudevotionalsongs #telugubhakthisongs #devotionaltime Watch ▻KARTHIKA SUKRAVARAM SPECIAL ...,Devotional Time,Bhakti
Jubin Nautiyal Bhakti songs | Best Songs Of Jubin Nautiyal | Bhajan Songs,jubinnautiyal #bhaktisong #kabira #srikrishnagovinda #merimaakebarabarkoinahifullsong #govindboloharigopalbolo ...,Love The Songs,Bhakti
హరిహరి గోవింద | HARI HARI GOVINDA | Tirumala Balaji Songs | Venkateswara Swamy Telugu Bhakti Songs,హరిహరి గోవింద | HARI HARI GOVINDA | Tirumala Balaji Songs | Venkateswara Swamy Telugu Bhakti Songs ...,Bhakthi Peetham - భక్తి పీఠం ,Bhakti
दीपावली नॉनस्टॉप राम भजन - Diwali NonStop Ram Bhajan - Ram Aayenge To Angana Sajaungi | Bhakti Song,दीपावली नॉनस्टॉप राम भजन - Diwali NonStop Ram Bhajan - Ram Aayenge To Angana Sajaungi | Bhakti ...,Bhakti Group,Bhakti
Non Stop Shiv Bhajan | Mahadev Songs | श्रावण मास के भजन | Bhakti Song | ॐ नम: शिवायः | शिव भजन,Non Stop Shiv Bhajan | Mahadev Songs | श्रावण मास के भजन | Bhakti Song | ॐ नम: शिवायः | शिव भजन ...,Nova Spiritual India,Bhakti
Full Video | आहे आदितमल | #Karina Pandey | #Sovita Pandey | Aahe Aaditmal | Chhath Special Song 2025,Karinapandey #sovitapandey #karinapandeykagana Full Video | आहे आदितमल | #Karina Pandey | #Sovita Pandey | Aahe ...,PANDEY SISTERS  OFFICIAL,Bhakti
LIVE : DIWALI 2025 SPECIAL - LAKSHMI DEVI DEVOTIONAL SONGS | LAKSHMI DEVI | TELUGU BHAKTI SONGS,LIVE : DIWALI 2025 SPECIAL - LAKSHMI DEVI DEVOTIONAL SONGS | LAKSHMI DEVI | TELUGU BHAKTI SONGS ...,Mana Devotional,Bhakti
किशोरी कुछ ऐसा इंतजाम हो जाए | Kishori Kuch aisa Intejam ho Jaye Full song | RADHA RANI BHAJAN,किशोरी कुछ ऐसा इंतजाम हो जाए | Kishori Kuch aisa Intejam ho Jaye Full song #radharanibhajan ...,Shiv Tatva ,Bhakti
पकड़ लो हाथ बनवारी Pakad Lo Hath Banvari - Krishna Bhajan | Bhajan Songs | Nahin To Doob Jaenge,पकड़ लो हाथ बनवारी Pakad Lo Hath Banvari - Krishna Bhajan | Bhajan Songs | Nahin To Doob Jaenge आप ...,Nova Spiritual India,Bhakti
Keejo Kesari Ke Laal ~ कीजो केसरी के लाल | Lakhbir Singh Lakkha Hanuman Bhajan | NonStop Bhajan 🙏🏻,आप सभी भक्तों से अनुरोध है कि आप @Spiritualbhaktiindia चैनल को सब्सक्राइब करें ...,Spiritual Bhakti India,Bhakti
Nagula Chavithi Special Songs Jukebox | Telugu Devotional Songs | Naga Devatha Bhakti Songs,Nagula Chavithi Special Songs Jukebox — a divine collection of Telugu devotional songs dedicated to Naga Devatha (Serpent ...,SRI MATHA MUSICHOUSE27,Bhakti
Suno Krishna Pyaare | Swati Mishra Bhakti Song | Mohit Musik,krishnabhajan #bhajan #sunokrishnapyaare #swatimishra #swatimishrabhajan ♪Full Song Available on♪ JioSaavn: Spotify ...,Swati Mishra Bhakti,Bhakti
Adharam Madhuram Lofi - Krishna Bhajan | Bhakti Song | Bhajan Song | Madhurashtakam,Adharam Madhuram Lofi - Krishna Bhajan | Bhakti Song | Bhajan Song | Madhurashtakam आप सभी भक्तों से ...,Nova Bhajan Kirtan,Bhakti
सांसो की माला पे सिमरु मैं शिव का नाम - Sejal Keshari - Sanso Ki Mala - Shiv Bhajan - Bhakti Song,सांसो की माला पे सिमरु मैं शिव का नाम - Sejal Keshari - Sanso Ki Mala - Shiv Bhajan - Bhakti Song ...,Supernal Records India,Bhakti
राम भजन || नगरी हो अयोध्या सी || Nagri Ho Ayodhya Si || Roshni Pandey || Lotus Bhakti Sagar,For Create Reels :- ❤ भक्ति पूर्ण गानों के लिए क्लिक करें ...,Lotus Bhakti Sagar,Bhakti
Sundari (Official Video) Sanju Rathod Ft. Yashika Jatav | G-Spark | Marathi Song 2025,"Sanju Rathod presents the official music video of Sundari. This track is a beautiful mix of Marathi folk, commercial pop, and ...",Sanju Rathod SR,Romantic
"Best of Emraan Hashmi | Top 12 Hit Songs | Romantic, Dance &amp; Melodic Hits","""Get ready to relive the magic of Emraan Hashmi's iconic songs in this ultimate playlist! From soulful melodies to foot-tapping ...",GlobalSongs,Romantic
"90’S Old Hindi Songs🥰 90s Love Song💘 Udit Narayan, Alka Yagnik, Kumar Sanu, Sonu Nigam","90'S Old Hindi Songs   90s Love Song  Udit Narayan, Alka Yagnik, Kumar Sanu, Sonu Nigam songs Hindi Jukebox songs ...",Mandeep Dildaar,Romantic
"❤️Unconfessed Love - Romantic Songs❤️ | Apna Bana Le, Channa Ve, Dil Jhoom, Zaalima |Romantic Mashup",SUBSCRIBE to Timeless Tunes -https://bit.ly/4arAxZd Tracklist   Apna Bana Le Thoda Thoda Pyaar Dil Jhoom Pal Pal Dil Ke ...,Timeless Tunes,Romantic
"&quot;Kabhi Jo Badal Barse&quot; Song Video Jackpot | Arijit Singh | Sachiin J Joshi, Sunny Leone","Presenting Jackpot movie latest video ""Kabhi Jo Baadal Barse"" in voice of Arijit Singh featuring Sachiin J Joshi, Sunny Leone ...",T-Series,Romantic
90s Romantic Love Songs | 90 Hits Hindi Songs | 90s Sadabahar Gane | 90s Purane Gane | Old Songs,Relive the golden era of Bollywood with this collection of 90's Old Hindi Songs — a timeless blend of evergreen romantic hits and ...,Tips Official,Romantic
80’s के सुपरहिट गाने I सदाबहार पुराने गाने I Old is Gold I Bollywood Old Hindi Songs I लता मंगेशकर,80's Ke Superhit Gane II 80's Superhits II Bollywood Romantic Songs II Old is Gold II Evergreen Old Song II Bollywood Old ...,Jiabur Gaming ,Romantic
Satinder sartaj all love  top5 song Punjabi #comparison #ali73tv jutt #ekmotahathighumechala,Artist:- satinder sartaj Satinder Sartaj all song | Sanu Aaj Kal Sheesha Bada Ched Da Punjabi Song | Badi Lambi Hai Kahani Mere ...,iMannu.Pandit,Romantic
Best of 2000s Bollywood Songs,"Mohit Chauhan Jukebox Enjoy a collection of some of the most iconic Bollywood tracks sung by the talented Mohit Chauhan, ...",Utsav Unfiltered,Romantic
Sanam Teri Kasam All Songs Jukebox Romantic Songs Trending Songs,Sanam Teri Kasam All Songs Jukebox Romantic Songs Trending Songs #hindisadsongs #song #bolleywoodsong ...,Rakesh Poddar Mtr,Romantic
True Love Mashup 2025 | Nonstop ArijitSingh | Jukebox | Latest Romantic Songs |,True Love Mashup 2025 | Nonstop Arijit Singh | Jukebox | Latest Romantic Songs |. Use headphone for best experience,Love status sj ,Romantic
Non Stop Love Mashup 2025 || Arijit Singh Love Songs || Romantic Songs 2025,Non Stop Love Mashup 2025 | Arijit Singh Romantic Hits | Best Love Songs Collection 2025 Get ready to fall in love all over ...,Sweet Harmony,Romantic
💖 Best Romantic Bollywood Songs | Heart-Touching True Love Hits 🎶,Best Romantic Bollywood Songs | Heart-Touching True Love Hits Welcome to Remix By AD7 – Where Music Lives Forever!,Remix By AD7,Romantic
"Nonstop Hits Of Udit Narayan, Alka Yagnik &amp; Kumar sanu | Evergreen Bollywood Hits | 90s Hindi Songs",Relive the golden era of Bollywood with 90s Sadabahar Purane Gane! Enjoy the ultimate collection of 90s Hits Hindi Songs filled ...,Tips Official,Romantic
TOP 5 ROMANTIC SONGS OF EMRAAN HASHMI  \ BEST ROMANTIC SONGS OF EMRAAN HASHMI \ ROMANTIC SONGS,TOP 5 ROMANTIC SONGS OF EMRAAN HASHMI \ BEST ROMANTIC SONGS OF EMRAAN HASHMI \ ROMANTIC SONGS.,All Types Of Fabric ,Romantic
New Trending Love Songs | Hindi Romantic Songs Collection | New Hindi Love Songs #viral,New Trending Love Songs | Hindi Romantic Songs Collection | New Hindi Love Songs 2025 | Nonstop Romantic Songs Playlist ...,Grow Music ,Romantic
"90s Romantic Songs | Hind Gane | 90s Hits Hindi Songs | Old Hindi Songs | Sadabahar Song, Love Songs",Lose yourself in the magic of 90s Romantic Songs – the era of true love and timeless melodies! From Hindi Gane to Old Hindi ...,Tips Official,Romantic
Best of ATIF ASLAM Songs | Bollywood Romantic Love Songs | Audio Jukebox | Hindi Hit Songs,Best of ATIF ASLAM Songs | Bollywood Romantic Love Songs | Audio Jukebox | Hindi Hit Songs #atifaslamsongs #atifaslam ...,Balkrishan Khatri,Romantic
90&#39;s सुपरहिट्स गाने | Sadabahar Gaane | 90&#39;s Bollywood Evergreen Songs | 90&#39;s All Time Hits Songs,90's सुपरहिट्स गाने | Sadabahar Gaane | 90's Bollywood Evergreen Songs | 90's All Time Hits Songs 00:00 Dil ...,90's Dard - Bollywood Songs,Romantic
Top 10 Best Romantic songs of Shreya Ghoshal 2025 | HM LO-FI 🎶 | #shortsfeed #shreyaghoshal,Top 10 Best Romantic songs of Shreya Ghoshal 2025 | HM LO-FI | #shortsfeed #shreyaghoshal If you like this video then don't ...,HM LO-FI 🎶,Romantic
Saiyaara Movie All Songs | #saiyaara #sadsong,Saiyaara Movie All Songs | Jukebox | Shiv-Kanya Lo-fi | #song​​ #jukebox​​ #yrf​​ #lovesong​​ #love​​ #musicCredit​​ ...,MK LOFI WORLD,Romantic
Romantic Love Mashup 2025 | Nonstop - Jukebox | Arijit Singh | Latest Romantic Songs | Rolex Music,Romantic Love Mashup 2025 | Nonstop - Jukebox | Arijit Singh | Latest Romantic Songs | Rolex Music Music By - Rolex Music ...,Rolex Music,Romantic
Best Romantic Hindi Songs 2025 |  New Romantic Song | Bollywood Love Hits Jukebox,Best Romantic Hindi Songs 2025 | New Romantic Song | Bollywood Love Hits Jukebox https://youtu.be/0VJPnZV7u10.,The Bollywood Fusion,Romantic
Vibes of Love Mashup 2025 | Nonstop - Jukebox | Arijit Singh | Latest Romantic Songs | Rolex Music,Vibes of Love Mashup 2025 | Nonstop - Jukebox | Arijit Singh | Latest Romantic Songs | Rolex Music Music By - Rolex Music ...,Rolex Music,Romantic
Non Stop Road Trip Love Hits - Full Album | 3 Hour Non-Stop Romantic Songs | 50 Superhit Love Songs,SUBSCRIBE to Timeless Tunes -https://bit.ly/4arAxZd Tracklist: 00:00:00 - Apna Bana Le 00:04:22 - Rabba Janda 00:08:27 ...,Timeless Tunes,Romantic
Vibes Of Love Mashup || Latest Bollywood Songs Jukebox 2025  || Romantic Jukebox Nonstop,"Vibes Of Love Mashup || Latest Bollywood Songs Jukebox 2025 || Romantic Jukebox Nonstop Welcome to ""Vibes Of Love ...",Sweet Harmony,Romantic
"90’S Old Hindi Songs🥰 90s Love Song💘 Udit Narayan, Alka Yagnik, Kumar Sanu, Sonu Nigam","90'S Old Hindi Songs   90s Love Song  Udit Narayan, Alka Yagnik, Kumar Sanu, Sonu Nigam songs Hindi Jukebox songs ...",Mandeep Dildaar,Romantic
Best Of Arijit Singh Romantic Songs |#arijitsingh #romanticsongs #bestofbest Arijit Singh all Sonng,Few Trending Videos Video 1: https://www.youtube.com/watch?v=D6T3PPjHZ1Q Video 2: ...,Ronak Bhatt,Romantic
"WAJAH TUM HO Full Video Song | HATE STORY 3 Songs | Zareen Khan, Karan Singh Grover | T-Series","Presenting Wajah Tum Ho HATE STORY 3 Full Video Song in the voice of Armaan Malik starring Karan Singh Grover, Zareen ...",T-Series,Romantic
പ്രണയം തുളുമ്പും അനുരാഗ ഗാനങ്ങൾ | Malayalam Romantic Songs | Malayalam Film Songs | Evergreen Songs,പ്രണയം തുളുമ്പും അനുരാഗ ഗാനങ്ങൾ | Malayalam Romantic Songs | Malayalam Film Songs ...,Malayalam Cassettes Jukebox,Romantic
&quot;Soda Pop&quot; Official Lyric Video | KPop Demon Hunters | Sony Animation,Listen to the KPop Demon Hunters soundtrack here: https://kpopdemonhunters.lnk.to/Soundtrack About KPop Demon Hunters: ...,Sony Pictures Animation,Pop
“Golden” Official Lyric Video | KPop Demon Hunters | Sony Animation,"We're going up, up, up. Watch the official lyric video for “Golden” from KPop Demon Hunters. KPop Demon Hunters is now on ...",Sony Pictures Animation,Pop
"Oh Mama! TETEMA (Song) | Rayvanny, Nora Fatehi | Shreya Ghoshal, Vishal Mishra, Sanjoy | Bhushan K",Presenting “Oh Mama! TETEMA (Song)” Feat. Rayvanny & Nora Fatehi. Gulshan Kumar & T-Series Present Bhushan Kumar's “Oh ...,T-Series,Pop
Taylor Swift - The Fate of Ophelia (Official Music Video),The official music video for “The Fate of Ophelia” Stream/download 'The Life of a Showgirl': ...,Taylor Swift,Pop
JISOO X ZAYN - EYES CLOSED (OFFICIAL MV),JISOO X ZAYN - EYES CLOSED (OFFICIAL MV) Follow JISOO youtube : www.youtube.com/@sooyaaa__ instagram ...,JISOO,Pop
Sabrina Carpenter - Manchild (Official Video),Stream “Manchild” here: https://sabrinacarpenter.lnk.to/Manchild New merch available: ...,SabrinaCarpenterVEVO,Pop
Spotify VIRAL Music 2025 ~ Top Spotify Songs Mix 🎧 Trending Songs 2025 ~ Best Pop Hits Playlist 2025,Spotify VIRAL Music 2025 ~ Top Spotify Songs Mix Trending Songs 2025 ~ Best Pop Hits Playlist 2025 ...,Dynamic Deep House,Pop
Mercy - Badshah Feat. Lauren Gottlieb | Official Music Video | Latest Hit Song 2017,"Listen & Download ""Mercy"" : https://smi.lnk.to/Mercy BADSHAH, the #1 Hit Machine is back with a bang with a sensational new ...",Sony Music India,Pop
Top 5 Most Popular Zubeen Garg Songs😭🎧| Ya Ali-Mayabini | Legend Never Die | #explore​ #ytshorts​,Top 5 Most Popular Zubeen Garg Songs    | Ya Ali-Mayabini | Legend Never Die | #explore​ #ytshorts​ Top 5 Most Popular ...,GOD R,Pop
"Lady Gaga, Bruno Mars - Die With A Smile (Official Music Video)","MAYHEM OUT NOW http://ladygaga.com Listen to “Die With A Smile”, song and video out now: ...",LadyGagaVEVO,Pop
"Top 20 Pop Songs 2025 ♫ Bruno Mars, Lady Gaga, Dua Lipa, Adele, Ed Sheeran, The Weeknd #18","Top 20 Pop Songs 2025 ♫ Bruno Mars, Lady Gaga, Dua Lipa, Adele, Ed Sheeran, The Weeknd #18 Listen & Download ...",Slow Acoustic,Pop
"Billboard Pop Songs 2025 Playlist ✨Ed Sheeran, The Weeknd, Bruno Mars, Rihanna, Sia, Adele, Dua Lipa","popmusic #TopHits2025 #PopMusic #NewPopularSongs #BestEnglishSongs Billboard Pop Songs 2025 Playlist ✨Ed Sheeran, ...",Top Song 2025,Pop
Tauba Tauba | Bad Newz | Vicky Kaushal | Triptii Dimri | Karan Aujla,"Experience the magic of Vicky Kaushal, Triptii Dimri and Karan Aujla's first-ever collaboration in ""Tauba Tauba"" from Bad Newz!",Saregama Music,Pop
“What It Sounds Like” Song Clip | KPop Demon Hunters | Netflix Family,"Rumi, Zoey, and Mira reunite on stage to fight Gwi-Ma and his demon army while singing the song they couldn't write. Sing along ...",Netflix Family,Pop
KGF: Gali Gali 8K Video Song | Neha Kakkar | Mouni Roy | Tanishk Bagchi | Rashmi Virag | T-Series,"Presenting the 8K Video Song ""Gali Gali"" from the film ""KGF"". Ritesh Sidhwani, Farhan Akhtar And AA Films Presents A Hombale ...",T-Series,Pop
Sabrina Carpenter - Espresso,"Music video by Sabrina Carpenter performing Espresso.© 2024 Island Records, a division of UMG Recordings, Inc.",SabrinaCarpenterVEVO,Pop
Top Hits 2025 ~ Summer Playlist 2025 ~ Top Songs 2025 Trending Music 🎶🎧,"Welcome to your ultimate summer soundtrack. This summer playlist is packed with the top hits 2025, blending the biggest ...",Revive Music,Pop
K-Pop Demon Hunters Songs on Cool Instruments!,Your favorite songs from K-Pop Demon Hunters but on Cool Musical Instruments! Shoutout to my kids Chet and Alex who ...,Joe Porter,Pop
Saja Boys - Soda Pop (Lyrics) | K-Pop Demon Hunters Soundtrack,Follow the official 7clouds playlist on Spotify : http://spoti.fi/2SJsUcZ ​   Saja Boys - Soda Pop (Lyrics) | K-Pop Demon Hunters ...,7clouds,Pop
Real-Life Rumi Sings &quot;Soda Pop&quot; - &quot;KPop Demon Hunters (케이팝 데몬 헌터스)&quot; - Part 1,"""Soda Pop"" is a song performed by Andrew Choi, Neckwav, Danny Chung, Kevin Woo, and SamUIL Lee as the fictional boy band ...",Jubilee Christ,Pop
Tyla - IS IT (Official Music Video),"Tyla - IS IT (Official Music Video) ""IS IT"" available at: https://tyla.lnk.to/ISIT Follow Tyla: https://instagram.com/tyla ...",TylaVEVO,Pop
Vidya Vox - Be Free (Pallivaalu Bhadravattakam) ft. Vandana Iyer,"Official video for Vidya Vox's 2016 single ""Be Free"" and Malayalam folk song ""Pallivaalu Bhadravattakam"", by Vandana Iyer from ...",Vidya Vox,Pop
Pop Music 2025 - Top Pop Songs 2025 - Billboard Top 100 🎧🔥 Justin Bieber Billie Eilish Miley Cyrus,"The ultimate pop music 2025 mix — a nonstop pop playlist of the biggest pop hits, new pop songs, and chart-topping favorites.",Revive Music,Pop
"Pop Song 2025 - Bruno Mars, Adele, Dua Lipa, Ed Sheeran, Selena Gomez, Maroon 5, Taylor Swift","Get a sneak peek at the future of pop music with this compilation of songs from Bruno Mars, Adele, Dua Lipa, Ed Sheeran, and ...",Pop Music,Pop
Alisha Chinai - Made In India - Alisha Chinai | Official Lyric Video,"Made In India - Alisha Chinai | Official Video | Biddu | Shyam Anuragi Description Presenting the iconic ""Made In India"" in its lyrical ...",SonyMusicIndiaVEVO,Pop
K-POP DEMON HUNTERS PLAYLIST OST,"Get ready to vibe with the hottest remixes! If you enjoy this video, make sure to LIKE, SUBSCRIBE, and turn on the for more ...",TRAP MISC ,Pop
&quot;Soda Pop&quot; IRL Live Action Music Video | KPop Demon Hunters Saja Boys | Dance Cover | Sony Animation,sodapop #sajaboys #kpopdemonhunters Soda Pop Cover song lead vocals by Uncle Nick - https://www.instagram.com/nick_l_le/ ...,Le Gianna,Pop
"Top 20 Pop Songs 2025 ♫ Bruno Mars, Lady Gaga, Dua Lipa, Adele, Ed Sheeran, The Weeknd #3","Top 20 Pop Songs 2025 ♫ Bruno Mars, Lady Gaga, Dua Lipa, Adele, Ed Sheeran, The Weeknd #3 Listen & Download ...",Slow Acoustic,Pop
KATSEYE - Gabriela (Lyrics),Follow the official 7clouds playlist on Spotify : http://spoti.fi/2SJsUcZ ​   KATSEYE - Gabriela (Lyrics) ⏬ Download / Stream: ...,7clouds,Pop
The Songs perfectly matches the scene 😍 ( KPop Demon Hunters ),Credit: Sony Pictures Animation KPop Demon Hunters Sources: Netflix ROSÉ Black Eyed Peas Laila Inspired by ...,Pop Realm,Pop
Chill Lofi Mix [chill lo-fi hip hop beats],"YouTube Playlists: http://listen.settle.fm/youtube Listen on Spotify, Apple Music & more: https://listen.settle.fm/playlists Tracklist ...",Settle,Lofi
90&#39;s Chill Lofi ☕️ Study Music Lofi Rain Chillhop Beats ☔️ Lofi Rain Playlist,The Japanese Town is dedicated for lofi beats & lofi rain music. We present relaxing rain Atmosphere and lofi ambience which is ...,The Japanese Town,Lofi
Best of lofi hip hop 2021 ✨ [beats to relax/study to],"Listen on Spotify, Apple music and more → https://fanlink.tv/BestofLofi2021 The new Lofi Girl compilation “Best of 2021” is out now ...",Lofi Girl,Lofi
Chill Lofi Beats Mix [chill lo-fi hip hop beats/Study &amp; Relax Music],"lofimusic #chill #lofi #lofihiphop # Chill Lofi Beats [chill lo-fi hip hop beats] Chill Drive - Lofi hip hop mix - Stress Relief, Relaxing ...",Art Is Sound,Lofi
Ｎｉｇｈｔ Ｄｒｉｖｅ ~ lofi hip hop mix ~ beats to chill / drive to,Listen to PUEBLO VISTA // ⟪ pvmm ⟫ → https://pvmm.ffm.to/lofivibes → https://pvmm.ffm.to/chillbeats ...,Mimi Lofi Chill,Lofi
Chill Lofi Mix (Fall 2024) [chill lo-fi hip hop beats],"Chill lo-fi music to help you work, study or relax. Thank you for listening Listen on Spotify, Apple Music & more: ...",Settle,Lofi
1 A.M Study Session 📚 [lofi hip hop],"Listen on Spotify, Apple music and more → https://fanlink.tv/lofigirl-music | Create your lofi avatar now ...",Lofi Girl,Lofi
Chill Summer Lofi [chill lo-fi hip hop beats],A chill selection of instrumental lofi beats for the summer season. 🏝️ Subscribe: http://youtube.com/@settlefm Listen on ...,Settle,Lofi
Cozy Night Vibes | Lofi Chill Beats for Sleep &amp; Relax 🌙,"A calm and cozy lofi beats mix for quiet nights and peaceful vibes. Perfect for reading, relaxing, or falling asleep. Let this ...",Lofi Shelter,Lofi
Lofi Chill Mix 🌃 Retro Rooftop Ambience in Tokyo | Relaxing Beats for Work &amp; Focus,Lofi Chill Mix Retro Rooftop Ambience in Tokyo | Relaxing Beats for Work & Focus #LofiHipHop #JapaneseLofi #RetroVibes ...,Lofi Tokyo Dreams,Lofi
Lofi HipHop Mix 🌻 Happy and Uplifting Beats for a Beautiful Day,Lofi HipHop Mix Happy and Uplifting Beats for a Beautiful Day ...,Lofi & Chill Beats,Lofi
Chill Study Beats 4 • jazz &amp; lofi hiphop Mix [2017],Listen to Chill Study Beats 9! ・ https://chillhop.ffm.to/csb2025.OYD/youtube Thanks to all 1 million of you who share the love for ...,Chillhop Music,Lofi
Ｓｍｏｋｅ　Ａｎｄ　Ｃｈｉｌｌ 🚬 Lofi Hip Hop 🎵 [ Beats To Smoke / Chill / Relax / Stress Relief ],Ｓｍｏｋｅ Ａｎｄ Ｃｈｉｌｌ Lofi Hip Hop [ Beats To Smoke / Chill / Relax / Stress Relief ] ...,Chill Melodies,Lofi
90&#39;s Lofi City 🌧️ Rainy Lofi Hip Hop 🎶 Lofi Music &amp; Rain Sounds,90's Lofi City 🌧️ Rainy Lofi Hip Hop Lofi Music & Rain Sounds 90's Lofi City 🌧️ Rainy Lofi Hip Hop Lofi Music & Rain ...,Chill Cities Vibes,Lofi
Chill Summer Beats [chill lofi hip hop beats],"A selection of chill lo-fi beats for the summer season. Listen on Spotify, Apple Music & more: https://listen.settle.fm/playlists ...",Settle,Lofi
Why the rush? - lo-fi beats for work/study / cat jazz,jazzhop #chillhop #citypop #rainlofi #lofirain #studymusic #studywithme #lofi #lofihiphop #lofibeats #beatstostudy #chillmusic ...,chill chill journal,Lofi
lofi hip hop radio 📚 beats to relax/study to,"Listen on Spotify, Apple music and more → https://link.lofigirl.com/m/music | Lofi Girl on all social media ...",Lofi Girl,Lofi
Enchanted Forest 🍃 Chill Lofi Beats,Listen on Spotify https://spoti.fi/43uhUi9 tracklist: 0:00 Medda - when it rains https://soundcloud.com/imedda/when-it-rains 2:38 ...,the bootleg boy,Lofi
