Title,Description,Channel,Genre
"Chill Vibes 🎧😌💨 Lofi hip hop ~ Healing Music, Relaxing, Study To","chilli music: https://open.spotify.com/playlist/5SDPei4m0IuABIYRsDJcBC Chill Vibes Lofi hip hop ~ Healing Music, ...",chilli music,Lofi
Chill Drive - Aesthetic Music ~ Lofi hip hop mix,Music provided by Chill Beats Records: https://spoti.fi/3CDd8Cq | Stream it: https://listen.chillbeats.com/chillbeatsmusic | Lofi ...,chilli music,Lofi
"lofi sleep, lo-fi rain 💤 8 hours mix 😴  beats to sleep/chill/relax to - music for insomnia &amp; anxiety",Listen to this playlist on your favorite platform: Spotify: https://sleeptales.lnk.to/lofisleeplofirainYM/spotify Tidal: ...,Sleep Tales,Lofi
"Upbeat Lofi - Deep Focus &amp; Energy for Work [R&amp;B, Neo Soul, Lofi Hiphop]",Power through the day with our lofi hiphop for deep focus and energy. Become A Lofi Soul & Subscribe: ...,A Lofi Soul,Lofi
Night Smoke Lofi 🚬 Lofi Hip Hop &amp; Chillhop Mix ~ Relaxed Vibes for Smoking,Night Smoke Lofi Lofi Hip Hop & Chillhop Mix ~ Relaxed Vibes for Smoking https://youtube.com/live/_-UlZAdX8Ec Night Smoke ...,Mimi Lofi Chill,Lofi
"Morning Energy Boost with Lofi ☀️🎶 | Uplifting &amp; Chill Beats for Focus, Relaxation &amp; Productivity",Welcome to Owl Lo-Fi Music Indulge in the delightful and heartwarming sounds of our adorable lofi Owl mix! Whether you're ...,Owl Lo-Fi Music,Lofi
Get Sleepy 💤 Chill Lofi Beats 🛌 beats to sleep / chill to • lofi type beat,Get Sleepy Chill Lofi Beats beats to sleep / chill to • lofi type beat https://youtube.com/live/i8WVCyb2Zk4 Get Sleepy Chill ...,Chill Melodies,Lofi
Waffle’s Forest Book Nook 📚 Soft Lofi to Escape With#lofihiphop #chillmusic #coffeemusic #studymusic,"Otterspace Lofi   Float away on calming beats for study, coffee breaks, relaxation  Jazz HipHop... Curated Lo-fi & Chillhop ...",Otterspace Lofi,Lofi
Quiet Solitude - Lofi Song ~ Lofi hip hop mix ~ Stress Relief / Relaxing Music / Smoke &amp; Chill,Quiet Solitude - Lofi Song ~ Lofi hip hop mix ~ Stress Relief / Relaxing Music / Smoke & Chill | Chilli High: ...,Chilli High,Lofi
"Seaside Coffee 🍵 Feel your peace &amp; Relax 🌱 Coffee Morning | Lofi Hip Hop - Chill to work, relax",Healing me: https://open.spotify.com/playlist/5qjqOmpbWnorOGrD4N2lHd?si=28ccf74df96f4273 Seaside Coffee Feel your ...,Healing Me,Lofi
Lofi Work Space 📂 Deep Focus Study/Work Concentration [chill lo-fi hip hop beats],Lofi Work Space Deep Focus Study/Work Concentration [chill lo-fi hip hop beats] #Lofi #DeepFocus #Concentration #Daily ...,𝗖𝗛𝗜𝗟𝗟 𝗩𝗜𝗟𝗟𝗔𝗚𝗘,Lofi
"Neo-Soul &amp; Jazzy R&amp;B Lo-Fi 🎶 | Chill Soul Beats to Unwind, Focus &amp; Vibe",lofisoul #neosoulvibes #neosoulmusic #lofirnb #souljazz #ChillBeats #relaxingmusicforstudy #FocusVibes #unwindandrelax ...,SoulFi Room ,Lofi
